{"attempt_binding":{"attempt_id":"docattempt-ef3032c82e618c8ace8e33b26326d5c6","receipt_contract":"documentation_collection_receipt@0.5.0","receipt_schema_sha256":"307777c1e4df625b82a8186fb5260b2426c1425009d0f2da400a2e7b0655e5db","receipt_sha256":"eeb8287ecceddb35ad4eef5c36f14fa94ef04b2bff5f8b25bcba27d59a6841a3"},"contract":"documentation_evidence_validation@0.1.0","decode":"utf_8_strict","findings":[{"claim":"For Gemini 2.5 Flash (a model earlier than Gemini 3), thinking is controlled by thinking_budget: when unset the model controls it automatically, the settable range is 1 to 24,576 tokens, and setting it to 0 prevents thought content from being returned -- though the source qualifies that reasoning-style text may still appear in the output. Using thinking_level with a model earlier than Gemini 3 makes the model return an error.","claim_attribution":"human_reading_of_the_verified_range","evidence_kind":"gemini_thinking","forbidden_literal_count":0,"forbidden_literals":[],"raw_byte_count":624675,"raw_reference":"gemini_thinking/sha256-e47448c0d68f0465035af00aac7f8969ffdcfebf7a491f444b3bd81c4503df7d/document.html","raw_sha256":"e47448c0d68f0465035af00aac7f8969ffdcfebf7a491f444b3bd81c4503df7d","required_literal_count":10,"required_literals":["For models earlier than Gemini 3","thinking_budget","not set, the model automatically controls how much it thinks","<td>Gemini 2.5 Flash</td>\n<td>1</td>\n<td>24,576</td>","set the budget to 0 to prevent thought content from being","no thought content is returned with the","However, reasoning-style text might still be present in the model","thinking_level","parameter with a model earlier than Gemini 3, the","model returns an error"],"slice_byte_count":2407,"slice_sha256":"b6a6195df8dbfc21b329f029999981ca1c2f17fe19edeb18d558cf85b28c533c","slice_start":367041,"slice_stop":369448},{"claim":"The CountTokens API carries no monetary charge. The same passage also states a maximum quota of 3000 requests per minute, so this evidence supports a zero-price claim and a 3000 RPM rate-limit claim together; it does not support a claim that no quota applies.","claim_attribution":"human_reading_of_the_verified_range","evidence_kind":"count_tokens","forbidden_literal_count":0,"forbidden_literals":[],"raw_byte_count":284918,"raw_reference":"count_tokens/sha256-e7cb9e6b4142ea79f9f39c905fd8b2395c090826ec5d03e59a1e36da3c9fda4d/document.html","raw_sha256":"e7cb9e6b4142ea79f9f39c905fd8b2395c090826ec5d03e59a1e36da3c9fda4d","required_literal_count":4,"required_literals":["There is no charge or quota restriction for using the","CountTokens","maximum quota for the","3000 requests per minute"],"slice_byte_count":321,"slice_sha256":"6491feec0ef68e1aa300882291f4a29929ae846150d850a5ba2c44938029f6d5","slice_start":251498,"slice_stop":251819},{"claim":"For Gemini 2.5 Flash, text/image/video input is $0.30 per 1M tokens and text output (response and reasoning) is $2.50 per 1M tokens, with the same price in both prompt-length tiers.","claim_attribution":"human_reading_of_the_verified_range","evidence_kind":"pricing_standard","forbidden_literal_count":0,"forbidden_literals":[],"raw_byte_count":828714,"raw_reference":"pricing_standard/sha256-2c96306a245ba39051e0f5c5a2b1359fd55425f6b7e7f17a2c5b4f57ca0fd3fc/document.html","raw_sha256":"2c96306a245ba39051e0f5c5a2b1359fd55425f6b7e7f17a2c5b4f57ca0fd3fc","required_literal_count":3,"required_literals":["Gemini 2.5<br>Flash","<td>Input (text, image, video)</td>\n           <td>$0.30</td>\n           <td>$0.30</td>\n           ","<td>Text output (response and reasoning)</td>\n           <td>$2.50</td>\n           <td>$2.50</td>\n           "],"slice_byte_count":620,"slice_sha256":"cf451af8ca6860efb6d03d71b77ff81c026e9c76506ebf32f742872cf4bcaa6e","slice_start":681132,"slice_stop":681752}],"normalization":"none","pricing_units":{"cost_formula":"ceil(input_tokens * 3 / 10) + ceil(output_tokens * 5 / 2)","derivation":"1 USD = 1000000 microdollar; $0.30 per 1000000 tokens = 300000/1000000 = 3/10 microdollar per token; $2.50 per 1000000 tokens = 2500000/1000000 = 5/2 microdollar per token","input_denominator":10,"input_numerator":3,"microdollar_per_usd":1000000,"model":"gemini-2.5-flash","output_denominator":2,"output_numerator":5,"prompt_length_tiers":2,"tier_prices_equal":true,"unit":"microdollar_per_token"},"schema_version":"0.1.0","selection_provenance":"human_selected_byte_slice_v1","subject":"vertex_ai_gemini_2_5_flash"}
